{
  "$schema": "https://json-schema.org/draft/2020-12/schema",
  "$id": "https://raw.githubusercontent.com/wilanis/wilanis-js/main/packages/core/schemas/scenario.schema.json",
  "title": "scenario",
  "description": "One recorded run of a trigger: the seed and generated input, the stubbed results of every effectful node, and the report the run produced. wilanis fuzz writes them; wilanis regress replays them and diffs node by node.",
  "type": "object",
  "properties": {
    "$schema": {
      "description": "The kind of this document: its published schema URL, or the alias @wilanis/scenario.schema.json.",
      "enum": [
        "https://raw.githubusercontent.com/wilanis/wilanis-js/main/packages/core/schemas/scenario.schema.json",
        "@wilanis/scenario.schema.json"
      ]
    },
    "description": {
      "description": "What this scenario covers, in one or two sentences, so a reader knows why the recording is kept.",
      "type": "string",
      "minLength": 1
    },
    "label": {
      "description": "A short human name for this document, shown wherever a reader sees it instead of its path. Absent: the file name stands in.",
      "type": "string",
      "minLength": 1
    },
    "generated": {
      "description": "The command that wrote this scenario. A generated scenario is regenerated by that command and never edited: `wilanis rehearse --check` exits 1 when a file under `scenarios/rehearsed/` is stale, missing or extra against what the tree yields today. Absent: written by hand, kept as it is.",
      "enum": [
        "rehearse",
        "edges",
        "fuzz"
      ]
    },
    "trigger": {
      "description": "The trigger this run fired. A scenario replays a way in, not an implementation: the binding chosen under the profile decides which graphs actually run.",
      "$ref": "common.schema.json#/$defs/path"
    },
    "policy": {
      "description": "A policy this scenario replays instead of the trigger's fire: its `decide` is fired under the trigger's kind and settings, the way `wilanis rehearse` walks a policy's decision. The trigger must attach it (S005).",
      "$ref": "common.schema.json#/$defs/path"
    },
    "branch": {
      "description": "The decision this scenario proves: the graph that declares the switch, the switch's node id, the rule's expression (`else` for the else), and the node the rule routes to. `wilanis regress` names it first when the run differs; `wilanis check` refuses one the tree no longer has (S004).",
      "type": "object",
      "properties": {
        "graph": {
          "description": "The graph that declares the switch.",
          "$ref": "common.schema.json#/$defs/path"
        },
        "node": {
          "description": "The id of the switch node whose rule this scenario takes.",
          "$ref": "common.schema.json#/$defs/ident"
        },
        "when": {
          "description": "The rule's expression as the graph writes it, `else` for the else, or `<node> broke` for a node the switch catches.",
          "type": "string",
          "minLength": 1
        },
        "to": {
          "description": "The node the rule routes to.",
          "$ref": "common.schema.json#/$defs/ident"
        }
      },
      "required": [
        "graph",
        "node",
        "when",
        "to"
      ],
      "additionalProperties": false
    },
    "seed": {
      "description": "The seed wilanis fuzz generated this run's input from, so the same input can be generated again.",
      "type": "integer"
    },
    "in": {
      "description": "The input the trigger was fired with, generated from the seed and recorded as it was."
    },
    "context": {
      "description": "The context the run read, for a trigger whose kind hands one; what `fire.in` and any policy read from.",
      "type": "object"
    },
    "stubs": {
      "description": "dotted node path -> the value its operation returned.",
      "type": "object",
      "additionalProperties": {}
    },
    "sharedStubs": {
      "description": "dotted node path -> the digest of the value its operation returned, held under `stubs` in the directory's answers document. A command that records writes this in place of `stubs`; a person writes `stubs`. A path is in one of the two, never both.",
      "type": "object",
      "additionalProperties": {
        "$ref": "common.schema.json#/$defs/answerDigest"
      }
    },
    "cancelAt": {
      "description": "The dotted node path of one stubbed effect at which the replay cancels the run: wilanis regress aborts the run's signal when that node is reached, and the node rejects the way an aborted call does. Must be a key of stubs. wilanis fuzz never writes it; an author does, to pin a deadline.",
      "type": "string",
      "minLength": 1
    },
    "broken": {
      "description": "The dotted node paths of the nodes that break in this run: wilanis regress makes each one throw where it runs, and every effect of the graph it runs, so a switch that catches it routes where its `catch` says. A stub at or under a broken node is not used. wilanis rehearse --record writes it for a switch's catch branch (`<node> broke`), which it walks by making that node break. Each path is a key of `expect.nodes`, a node the run reports (S008).",
      "type": "array",
      "items": {
        "type": "string",
        "minLength": 1
      },
      "minItems": 1,
      "uniqueItems": true
    },
    "expect": {
      "description": "The report this run produced, which wilanis regress replays against and diffs node by node.",
      "type": "object",
      "properties": {
        "status": {
          "description": "How the run as a whole ended: done; failed (a refusal -- the graph's, a policy's or the guard's -- or a fault); blocked (a root it reads was never supplied); cancelled (its signal fired before it finished); or unreachable (the solver could reach no input for the scenario's branch, so nothing ran and `unreachable` says why).",
          "enum": [
            "done",
            "failed",
            "blocked",
            "cancelled",
            "unreachable"
          ]
        },
        "output": {
          "description": "What the run answered, recorded as it was."
        },
        "reason": {
          "description": "For a run that failed at a refuse node the graph declares, its reason (`refusalOf`), so a replay says when the declared outcome changed and not only that a node did.",
          "type": "string"
        },
        "unreachable": {
          "description": "Why the solver could reach no input for this branch, in its words. Present exactly when `status` is `unreachable`; the scenario then has no `in` and no `stubs`, and `regress` re-solves instead of running.",
          "type": "string",
          "minLength": 1
        },
        "nodes": {
          "description": "What each node did, by its dotted path, so a replay says which node first differs.",
          "type": "object",
          "additionalProperties": {
            "description": "What each node did, by its dotted path: the answer itself, or the digest of an answer the directory's answers document holds. A command that records writes digests; a person writes answers.",
            "if": {
              "description": "A string is a digest: no answer is a string, since every answer is an object with a `status`.",
              "type": "string"
            },
            "then": {
              "$ref": "common.schema.json#/$defs/answerDigest"
            },
            "else": {
              "$ref": "common.schema.json#/$defs/nodeAnswer"
            }
          }
        }
      },
      "required": [
        "status",
        "nodes"
      ],
      "if": {
        "description": "`status` says whether the solver reached the branch, so `unreachable` goes with the one status that says it did not.",
        "properties": {
          "status": {
            "description": "Selects the expectation of a branch no input reaches.",
            "const": "unreachable"
          }
        },
        "required": [
          "status"
        ]
      },
      "then": {
        "description": "A branch no input reaches: why, in the solver's words.",
        "required": [
          "unreachable"
        ]
      },
      "else": {
        "description": "A run that happened: its nodes say what it did, and nothing is left unreachable to explain.",
        "properties": {
          "unreachable": false
        }
      },
      "additionalProperties": false
    }
  },
  "required": [
    "$schema",
    "description",
    "trigger",
    "seed",
    "expect"
  ],
  "additionalProperties": false
}
