{"$schema":"https://raw.githubusercontent.com/wilanis/wilanis-js/main/packages/core/schemas/scenario.schema.json","description":"digest: list-rows 'outcome' when status == 200 && has(body) routes to customers, which answers. Written by wilanis rehearse --record; regenerate it, do not edit it.","generated":"rehearse","trigger":"@features/customers/edge/digest.trigger.json","branch":{"graph":"@features/customers/data/list-rows.graph.json","node":"outcome","when":"status == 200 && has(body)","to":"customers"},"seed":1,"context":{"flags":{},"args":[],"cwd":"hotel","file":{"id":"blob-6515","contentType":"application/octet-stream","size":27905},"principal":{"subject":"hotel403","realm":"delta489","roles":[],"claims":{}},"challenge":{"id":"charlie427","method":"india","verified":true}},"sharedStubs":{"op.all.op.customers:made":"cb789ea34b239204","op.all.op.fetched":"605ee3cb9793ba30"},"expect":{"status":"done","output":{"count":2,"text":"- Zulu-9 <echo @> kilo\n- lima190 <alpha @> india"},"nodes":{"op":"ea6c77f63c55adbb","op.all":"6a8e59cee484544d","op.all.op":"b490cb8892815f68","op.all.op.fetched":"d23cc7681d5ed24b","op.all.op.outcome":"a2e7a166314e5583","op.all.op.upstreamFailed":"a0af58eabbdc1659","op.all.op.customers:made":"f0bd9ed7343d5cf9","op.all.op.customers":"1f954aa88dee0068","op.lines":"002774c0f864692a","op.joined":"00c733f5c1c2d10b","op.count":"db5f22fbbb21653f","op.active":"3a75636d0be69ea5","op.activeCount":"082f748c31681d80","op.digest":"ad7853ce1c74a0fd"}}}
