{"$schema":"https://raw.githubusercontent.com/wilanis/wilanis-js/main/packages/core/schemas/scenario.schema.json","description":"remove-queued: delete-row 'outcome' when status == 200 && has(body) routes to customer, which answers. Written by wilanis rehearse --record; regenerate it, do not edit it.","generated":"rehearse","trigger":"@features/customers/edge/remove-queued.trigger.json","branch":{"graph":"@features/customers/data/delete-row.graph.json","node":"outcome","when":"status == 200 && has(body)","to":"customer"},"seed":1,"in":{"id":"golf"},"context":{"id":"juliet527","attempt":963,"queue":"echo","headers":{},"message":{"id":"golf"},"principal":{"subject":"hotel403","realm":"delta489","roles":[],"claims":{}},"challenge":{"id":"charlie427","method":"india","verified":true}},"sharedStubs":{"op.deleted":"cac7585c4f207149"},"expect":{"status":"done","output":{"id":"juliet527","name":"x","email":"echo @","tier":"kilo"},"nodes":{"op":"99fd8fbed6ad4c36","op.deleted":"3937faef35e9d0e3","op.outcome":"862be5bf6aa65348","op.noCustomer":"a0af58eabbdc1659","op.upstreamFailed":"a0af58eabbdc1659","op.customer:made":"84f0c22105ee55dd","op.customer:check":"43248f7fd83aa80d","op.customer":"84f0c22105ee55dd","op.customer:violated":"a0af58eabbdc1659","op.customer:violated:2":"a0af58eabbdc1659"}}}
