{"$schema":"https://raw.githubusercontent.com/wilanis/wilanis-js/main/packages/core/schemas/scenario.schema.json","description":"list-customers: list-rows 'outcome' otherwise routes to upstreamFailed, which refuses as upstream. Written by wilanis rehearse --record; regenerate it, do not edit it.","generated":"rehearse","trigger":"@features/customers/edge/list-customers.trigger.json","branch":{"graph":"@features/customers/data/list-rows.graph.json","node":"outcome","when":"else","to":"upstreamFailed"},"seed":1,"in":{},"context":{"method":"juliet527","path":"Zulu-9","headers":{"extra6":"kilo"},"cookies":{},"query":{},"params":{},"body":true,"principal":{"subject":"delta489","realm":"bravo","roles":["echo42","golf","lima205"],"claims":{}}},"sharedStubs":{"op.all.op.customers:made":"cb789ea34b239204","op.all.op.fetched":"2e6bcbdf1ffb2b43","op.byTier.op.customers:made":"cb789ea34b239204","op.byTier.op.none:made":"cb789ea34b239204","op.byTier.op.requested":"d2cbd15fb2300769"},"expect":{"status":"failed","reason":"upstream","nodes":{"op":"837c252b8e2ba4ba","op.tierGiven":"588132b0b9baa7a2","op.byTier":"a0af58eabbdc1659","op.all":"dd9472a37dfa1820","op.all.op":"fc0542f4856d2517","op.all.op.fetched":"7eee74e84d822b10","op.all.op.outcome":"f9ae8cf928d7c095","op.all.op.upstreamFailed":"0cd61b35d9bf3fe9","op.all.op.customers:made":"a0af58eabbdc1659","op.all.op.customers":"a0af58eabbdc1659"}}}
