{"$schema":"https://raw.githubusercontent.com/wilanis/wilanis-js/main/packages/core/schemas/scenario.schema.json","description":"register-customer under seed 1 with tier enum.silver: failed. Written by wilanis fuzz --edges; regenerate it, do not edit it.","generated":"edges","trigger":"@features/customers/edge/register-customer.trigger.json","seed":1,"in":{"name":"hotel403","email":"delta489 @","tier":"silver"},"context":{"method":"juliet527","path":"Zulu-9","headers":{"extra6":"kilo"},"cookies":{},"query":{},"params":{},"body":{"name":"hotel403","email":"delta489","tier":"bronze"},"principal":{"subject":"lima190","realm":"alpha","roles":["lima205","juliet"],"claims":{}},"session":{"id":"kilo","attributes":{"displayName":"lima","realm":"delta","tenant":"charlie","theme":"light"}},"challenge":{"id":"kilo","method":"bravo48","verified":false}},"sharedStubs":{"op.registered.op.posted":"8096eda2207329bf"},"expect":{"status":"failed","reason":"invariant","nodes":{"op":"b74c7dad99bea2df","op.id":"4aed64bb95947730","op.id.op":"1e79a10f4d117147","op.id.op.key":"4ec2f6740245d0ff","op.registered":"9cd10058878127c7","op.registered.op":"d4f684d8d0f6f94c","op.registered.op.posted":"6a3a37842c9d1652","op.registered.op.record":"28013043b785a507","op.registered.op.outcome":"862be5bf6aa65348","op.registered.op.upstreamFailed":"a0af58eabbdc1659","op.registered.op.in:check":"189c90c2c37d5e1d","op.registered.op.in:ok":"5ecb50bd6d41466c","op.registered.op.in:violated":"a0af58eabbdc1659","op.registered.op.in:violated:2":"a0af58eabbdc1659","op.registered.op.customer:made":"8ee7d065be5c0f93","op.registered.op.customer:check":"7cb49ee1eb6bb2b8","op.registered.op.customer":"a0af58eabbdc1659","op.registered.op.customer:violated":"a0af58eabbdc1659","op.registered.op.customer:violated:2":"8930de982c587ed3","op.customer:made":"5ecb50bd6d41466c","op.customer:check":"43248f7fd83aa80d","op.customer":"5ecb50bd6d41466c","op.customer:violated":"a0af58eabbdc1659","op.customer:violated:2":"a0af58eabbdc1659"}}}
