{"$schema":"https://raw.githubusercontent.com/wilanis/wilanis-js/main/packages/core/schemas/scenario.schema.json","description":"update-customer under seed 1 with name empty: failed. Written by wilanis fuzz --edges; regenerate it, do not edit it.","generated":"edges","trigger":"@features/customers/edge/update-customer.trigger.json","seed":1,"in":{"id":"hotel403","name":"","email":"bravo @","tier":"bronze","note":"charlie427"},"context":{"method":"juliet527","path":"Zulu-9","headers":{"extra6":"kilo"},"cookies":{},"query":{},"params":{"id":"hotel403"},"body":{"name":"delta489","email":"bravo","tier":"gold","note":"charlie427"},"challenge":{"id":"delta","method":"india","verified":true}},"sharedStubs":{"op.current.op.fetched":"354a7c4886afb64c"},"expect":{"status":"failed","reason":"upstream","nodes":{"op":"470af65fd48f34ac","op.current":"88f39e11be909a3a","op.current.op":"9251feeeb253c1ac","op.current.op.fetched":"c3bb5bfeed2a4592","op.current.op.outcome":"f9ae8cf928d7c095","op.current.op.noCustomer":"a0af58eabbdc1659","op.current.op.upstreamFailed":"0cd61b35d9bf3fe9","op.current.op.unreachable":"a0af58eabbdc1659","op.current.op.customer:made":"a0af58eabbdc1659","op.current.op.customer:check":"a0af58eabbdc1659","op.current.op.customer":"a0af58eabbdc1659","op.current.op.customer:violated":"a0af58eabbdc1659","op.current.op.customer:violated:2":"a0af58eabbdc1659","op.kept":"a0af58eabbdc1659","op.customer:made":"a0af58eabbdc1659","op.customer:check":"a0af58eabbdc1659","op.customer":"a0af58eabbdc1659","op.customer:violated":"a0af58eabbdc1659","op.customer:violated:2":"a0af58eabbdc1659"}}}
