{"$schema":"https://raw.githubusercontent.com/wilanis/wilanis-js/main/packages/core/schemas/scenario.schema.json","description":"update-customer: update-row 'outcome' when status == 200 && has(body) routes to customer, which answers. Written by wilanis rehearse --record; regenerate it, do not edit it.","generated":"rehearse","trigger":"@features/customers/edge/update-customer.trigger.json","branch":{"graph":"@features/customers/data/update-row.graph.json","node":"outcome","when":"status == 200 && has(body)","to":"customer"},"seed":1,"in":{"id":"hotel403","name":"delta489","email":"bravo @","tier":"bronze","note":"charlie427"},"context":{"method":"juliet527","path":"Zulu-9","headers":{"extra6":"kilo"},"cookies":{},"query":{},"params":{"id":"hotel403"},"body":{"name":"delta489","email":"bravo","tier":"gold","note":"charlie427"},"challenge":{"id":"delta","method":"india","verified":true}},"sharedStubs":{"op.current.op.fetched":"889c114a372d0271","op.kept.op.updated":"af4e1d5821c902e3"},"expect":{"status":"done","output":{"id":"juliet527","name":"x","email":"echo @","tier":"kilo"},"nodes":{"op":"e9fea6549089bad1","op.current":"cf932379fcd9b42c","op.current.op":"5d09b45b393e006d","op.current.op.fetched":"2d4017a41804fd09","op.current.op.outcome":"862be5bf6aa65348","op.current.op.noCustomer":"a0af58eabbdc1659","op.current.op.upstreamFailed":"a0af58eabbdc1659","op.current.op.unreachable":"a0af58eabbdc1659","op.current.op.customer:made":"b761a6a3496299ae","op.current.op.customer:check":"43248f7fd83aa80d","op.current.op.customer":"b761a6a3496299ae","op.current.op.customer:violated":"a0af58eabbdc1659","op.current.op.customer:violated:2":"a0af58eabbdc1659","op.kept":"9e42348ea80e5e2a","op.kept.op":"c84b8301cb1e81b0","op.kept.op.updated":"1795fda9d6e76214","op.kept.op.outcome":"862be5bf6aa65348","op.kept.op.noCustomer":"a0af58eabbdc1659","op.kept.op.upstreamFailed":"a0af58eabbdc1659","op.kept.op.in:check":"189c90c2c37d5e1d","op.kept.op.in:ok":"7383f045e6039647","op.kept.op.in:violated":"a0af58eabbdc1659","op.kept.op.in:violated:2":"a0af58eabbdc1659","op.kept.op.customer:made":"84f0c22105ee55dd","op.kept.op.customer:check":"43248f7fd83aa80d","op.kept.op.customer":"84f0c22105ee55dd","op.kept.op.customer:violated":"a0af58eabbdc1659","op.kept.op.customer:violated:2":"a0af58eabbdc1659","op.customer:made":"2caee7215852d132","op.customer:check":"43248f7fd83aa80d","op.customer":"7383f045e6039647","op.customer:violated":"a0af58eabbdc1659","op.customer:violated:2":"a0af58eabbdc1659"}}}
