{"$schema":"https://raw.githubusercontent.com/wilanis/wilanis-js/main/packages/core/schemas/scenario.schema.json","description":"issue-otp under seed 1 with id long: failed. Written by wilanis fuzz --edges; regenerate it, do not edit it.","generated":"edges","trigger":"@features/access/edge/issue-otp.trigger.json","seed":1,"in":{"id":"xxxxxxxxxxxxxxxxxxxxxxxxxxxxxxxxxxxxxxxxxxxxxxxxxxxxxxxxxxxxxxxxxxxxxxxxxxxxxxxxxxxxxxxxxxxxxxxxxxxxxxxxxxxxxxxxxxxxxxxxxxxxxxxxxxxxxxxxxxxxxxxxxxxxxxxxxxxxxxxxxxxxxxxxxxxxxxxxxxxxxxxxxxxxxxxxxxxxxxxxxxxxxxxxxxxxxxxxxxxxxxxxxxxxxxxxxxxxxxxxxxxxxxxxxxxxxxxx"},"context":{"flags":{},"args":[],"cwd":"hotel","file":{"id":"blob-6515","contentType":"application/octet-stream","size":27905},"principal":{"subject":"hotel403","realm":"delta489","roles":[],"claims":{}},"challenge":{"id":"charlie427","method":"india","verified":true}},"stubs":{"op.issued":{"issued":true,"code":"echo","expiresAt":"foxtrot"}},"expect":{"status":"failed","reason":"unknown_challenge","nodes":{"op":{"status":"failed","reason":"unknown_challenge","handler":"graph:@features/access/data/issue-code.graph.json"},"op.issued":{"status":"done","handler":"@auth/challenge.port.json#issue","out":{"issued":true,"code":"«secret»","expiresAt":"foxtrot"}},"op.wasThere":{"status":"done","selected":"unknown","out":"unknown"},"op.code":{"status":"cancelled"},"op.unknown":{"status":"failed","reason":"unknown_challenge","handler":"@std/outcome.port.json#refuse"}}}}
