{
  "$schema": "https://raw.githubusercontent.com/wilanis/wilanis-js/main/packages/core/schemas/scenario.schema.json",
  "description": "auth-customers: sign-in-customer 'verdict' when status == 'verified' && has(identity) routes to issued, which answers. Written by wilanis rehearse --record; regenerate it, do not edit it.",
  "generated": "rehearse",
  "trigger": "@features/access/edge/auth-customers.trigger.json",
  "branch": {
    "graph": "@features/access/domain/sign-in-customer.graph.json",
    "node": "verdict",
    "when": "status == 'verified' && has(identity)",
    "to": "issued"
  },
  "seed": 1,
  "in": {
    "username": "hotel403",
    "password": "delta489"
  },
  "context": {
    "method": "juliet527",
    "path": "Zulu-9",
    "headers": {
      "extra6": "kilo"
    },
    "cookies": {},
    "query": {},
    "params": {},
    "body": {
      "username": "hotel403",
      "password": "delta489"
    },
    "principal": {
      "subject": "foxtrot",
      "realm": "echo42",
      "roles": [
        "india"
      ],
      "claims": {
        "extra2": "x"
      }
    }
  },
  "stubs": {
    "op.checked": {
      "status": "verified",
      "identity": {
        "subject": "hotel",
        "name": "Zulu-9612",
        "groups": [
          "golf",
          "golf"
        ],
        "attributes": {
          "tenant": "golf154"
        }
      }
    },
    "op.issued.op": {
      "accessToken": "x",
      "refreshToken": "foxtrot",
      "tokenType": "Bearer",
      "expiresIn": 200,
      "sessionId": "echo"
    }
  },
  "expect": {
    "status": "done",
    "output": {
      "accessToken": "«secret»",
      "refreshToken": "«secret»",
      "tokenType": "Bearer",
      "expiresIn": 200
    },
    "nodes": {
      "op": {
        "status": "done",
        "handler": "graph:@features/access/domain/sign-in-customer.graph.json",
        "out": {
          "accessToken": "«secret»",
          "refreshToken": "«secret»",
          "tokenType": "Bearer",
          "expiresIn": 200,
          "sessionId": "echo"
        }
      },
      "op.checked": {
        "status": "done",
        "handler": "@features/directories/data/identity.binding.json#verifyCustomer",
        "out": {
          "status": "verified",
          "identity": {
            "subject": "hotel",
            "name": "Zulu-9612",
            "groups": [
              "golf",
              "golf"
            ],
            "attributes": {
              "tenant": "golf154"
            }
          }
        }
      },
      "op.verdict": {
        "status": "done",
        "selected": "issued",
        "out": "issued"
      },
      "op.issued": {
        "status": "done",
        "handler": "@features/directories/data/identity.binding.json#issue",
        "out": {
          "accessToken": "«secret»",
          "refreshToken": "«secret»",
          "tokenType": "Bearer",
          "expiresIn": 200,
          "sessionId": "echo"
        }
      },
      "op.issued.op": {
        "status": "done",
        "handler": "@auth/token.port.json#issue",
        "out": {
          "accessToken": "«secret»",
          "refreshToken": "«secret»",
          "tokenType": "Bearer",
          "expiresIn": 200,
          "sessionId": "echo"
        }
      },
      "op.rejected": {
        "status": "cancelled"
      },
      "op.unavailable": {
        "status": "cancelled"
      }
    }
  }
}
