{"$schema":"https://raw.githubusercontent.com/wilanis/wilanis-js/main/packages/core/schemas/scenario.schema.json","description":"auth-customers under seed 1 with password one: failed. Written by wilanis fuzz --edges; regenerate it, do not edit it.","generated":"edges","trigger":"@features/access/edge/auth-customers.trigger.json","seed":1,"in":{"username":"hotel403","password":"x"},"context":{"method":"juliet527","path":"Zulu-9","headers":{"extra6":"kilo"},"cookies":{},"query":{},"params":{},"body":{"username":"hotel403","password":"delta489"},"principal":{"subject":"foxtrot","realm":"echo42","roles":["india"],"claims":{"extra2":"x"}}},"stubs":{"op.checked.op":{"status":"verified"}},"expect":{"status":"failed","reason":"directory_unavailable","nodes":{"op":{"status":"failed","reason":"directory_unavailable","handler":"graph:@features/access/domain/sign-in-customer.graph.json"},"op.checked":{"status":"done","handler":"@features/directories/data/identity.binding.json#verifyCustomer","out":{"status":"verified"}},"op.checked.op":{"status":"done","handler":"@auth/identity.port.json#verify","out":{"status":"verified"}},"op.verdict":{"status":"done","selected":"unavailable","out":"unavailable"},"op.issued":{"status":"cancelled"},"op.rejected":{"status":"cancelled"},"op.unavailable":{"status":"failed","reason":"directory_unavailable","handler":"@std/outcome.port.json#refuse"}}}}
