{"$schema":"https://raw.githubusercontent.com/wilanis/wilanis-js/main/packages/core/schemas/scenario.schema.json","description":"register-customer under seed 1 with tier enum.gold: failed. Written by wilanis fuzz --edges; regenerate it, do not edit it.","generated":"edges","trigger":"@features/customers/edge/register-customer.trigger.json","seed":1,"in":{"name":"hotel403","email":"delta489","tier":"gold"},"context":{"method":"juliet527","path":"Zulu-9","headers":{"extra6":"kilo"},"cookies":{},"query":{},"params":{},"body":{"name":"hotel403","email":"delta489","tier":"bronze"},"principal":{"subject":"lima190","realm":"alpha","roles":["lima205","juliet"],"claims":{}},"session":{"id":"kilo","attributes":{"displayName":"lima","realm":"delta","tenant":"charlie","theme":"light"}},"challenge":{"id":"kilo","method":"bravo48","verified":false}},"expect":{"status":"failed","reason":"invariant","nodes":{"op":"b74c7dad99bea2df","op.id":"4aed64bb95947730","op.id.op":"1e79a10f4d117147","op.id.op.key":"4ec2f6740245d0ff","op.registered":"a0af58eabbdc1659","op.customer:made":"ef5ce4ef96710eeb","op.customer:check":"37ad74ad6dabc02e","op.customer":"a0af58eabbdc1659","op.customer:violated":"8930de982c587ed3","op.customer:violated:2":"a0af58eabbdc1659"}}}
