{"$schema":"https://raw.githubusercontent.com/wilanis/wilanis-js/main/packages/core/schemas/scenario.schema.json","description":"list-customers under seed 1 with tier enum.bronze: failed. Written by wilanis fuzz --edges; regenerate it, do not edit it.","generated":"edges","trigger":"@features/customers/edge/list-customers.trigger.json","seed":1,"in":{"tier":"bronze"},"context":{"method":"juliet527","path":"Zulu-9","headers":{"extra6":"kilo"},"cookies":{},"query":{},"params":{},"body":true,"principal":{"subject":"delta489","realm":"bravo","roles":["echo42","golf","lima205"],"claims":{}}},"sharedStubs":{"op.byTier.op.requested":"d2cbd15fb2300769"},"expect":{"status":"failed","reason":"invariant","nodes":{"op":"53a6d3a440e8148a","op.tierGiven":"30d7fa13f77292b3","op.byTier":"276bbb592f06aba7","op.byTier.op":"2238f9c908ddfba7","op.byTier.op.requested":"4a8a96c6f1e4f3ce","op.byTier.op.outcome":"a2e7a166314e5583","op.byTier.op.upstreamFailed":"a0af58eabbdc1659","op.byTier.op.customers:made":"f536a6fd489befd3","op.byTier.op.customers":"62c3718a3ebb3337","op.byTier.op.none:made":"a0af58eabbdc1659","op.byTier.op.none":"a0af58eabbdc1659","op.all":"a0af58eabbdc1659"}}}
