{"$schema":"https://raw.githubusercontent.com/wilanis/wilanis-js/main/packages/core/schemas/scenario.schema.json","description":"issue-otp: issue-code 'wasThere' otherwise routes to unknown, which refuses as unknown_challenge. Written by wilanis rehearse --record; regenerate it, do not edit it.","generated":"rehearse","trigger":"@features/access/edge/issue-otp.trigger.json","branch":{"graph":"@features/access/data/issue-code.graph.json","node":"wasThere","when":"else","to":"unknown"},"seed":1,"in":{"id":"delta"},"context":{"flags":{},"args":[],"cwd":"hotel","file":{"id":"blob-6515","contentType":"application/octet-stream","size":27905},"principal":{"subject":"hotel403","realm":"delta489","roles":[],"claims":{}},"challenge":{"id":"charlie427","method":"india","verified":true}},"stubs":{"op.issued":{"issued":false,"code":"echo","expiresAt":"foxtrot"}},"expect":{"status":"failed","reason":"unknown_challenge","nodes":{"op":{"status":"failed","reason":"unknown_challenge","handler":"graph:@features/access/data/issue-code.graph.json"},"op.issued":{"status":"done","handler":"@auth/challenge.port.json#issue","out":{"issued":false,"code":"«secret»","expiresAt":"foxtrot"}},"op.wasThere":{"status":"done","selected":"unknown","out":"unknown"},"op.code":{"status":"cancelled"},"op.unknown":{"status":"failed","reason":"unknown_challenge","handler":"@std/outcome.port.json#refuse"}}}}
