{"$schema":"https://raw.githubusercontent.com/wilanis/wilanis-js/main/packages/core/schemas/scenario.schema.json","description":"get-customer under seed 1 with id one: failed. Written by wilanis fuzz --edges; regenerate it, do not edit it.","generated":"edges","trigger":"@features/customers/edge/get-customer.trigger.json","seed":1,"in":{"id":"x"},"context":{"method":"juliet527","path":"Zulu-9","headers":{"extra6":"kilo"},"cookies":{},"query":{},"params":{"id":"hotel403"},"body":200,"principal":{"subject":"foxtrot","realm":"echo42","roles":["india"],"claims":{"extra2":"x"}}},"sharedStubs":{"op.fetched":"fab51527501ad488"},"expect":{"status":"failed","reason":"upstream","nodes":{"op":"9251feeeb253c1ac","op.fetched":"833c1e22475651d3","op.outcome":"f9ae8cf928d7c095","op.noCustomer":"a0af58eabbdc1659","op.upstreamFailed":"0cd61b35d9bf3fe9","op.unreachable":"a0af58eabbdc1659","op.customer:made":"a0af58eabbdc1659","op.customer:check":"a0af58eabbdc1659","op.customer":"a0af58eabbdc1659","op.customer:violated":"a0af58eabbdc1659","op.customer:violated:2":"a0af58eabbdc1659"}}}
