{"$schema":"https://raw.githubusercontent.com/wilanis/wilanis-js/main/packages/core/schemas/scenario.schema.json","description":"enqueue-removal: no switch under it, so one run is the whole of it, and it answers. Written by wilanis rehearse --record; regenerate it, do not edit it.","generated":"rehearse","trigger":"@features/customers/edge/enqueue-removal.trigger.json","seed":1,"in":{"id":"hotel403"},"context":{"method":"juliet527","path":"Zulu-9","headers":{"extra6":"kilo"},"cookies":{},"query":{},"params":{"id":"hotel403"},"body":200,"principal":{"subject":"foxtrot","realm":"echo42","roles":["india"],"claims":{"extra2":"x"}}},"stubs":{"op.published":{"id":"Zulu-9"}},"expect":{"status":"done","output":"Zulu-9","nodes":{"op":{"status":"done","handler":"graph:@features/customers/data/publish-removal.graph.json","out":"Zulu-9"},"op.published":{"status":"done","handler":"@queue/queue.port.json#publish","out":{"id":"Zulu-9"}},"op.queued":{"status":"done","handler":"@std/object.port.json#make","out":"Zulu-9"}}}}
