{
  "$schema": "https://raw.githubusercontent.com/wilanis/wilanis-js/main/packages/core/schemas/scenario.schema.json",
  "description": "employees-only as attached by delete-customer: require-employee 'isEmployee' when has(principal) && principal.realm == 'employee' routes to granted, which answers. Written by wilanis rehearse --record; regenerate it, do not edit it.",
  "generated": "rehearse",
  "trigger": "@features/customers/edge/delete-customer.trigger.json",
  "policy": "@features/access/edge/employees-only.policy.json",
  "branch": {
    "graph": "@features/access/domain/require-employee.graph.json",
    "node": "isEmployee",
    "when": "has(principal) && principal.realm == 'employee'",
    "to": "granted"
  },
  "seed": 1,
  "in": {
    "principal": {
      "subject": "foxtrot",
      "realm": "employee",
      "roles": [
        "india"
      ],
      "claims": {
        "extra2": "x"
      }
    }
  },
  "context": {
    "method": "juliet527",
    "path": "Zulu-9",
    "headers": {
      "extra6": "kilo"
    },
    "cookies": {},
    "query": {},
    "params": {
      "id": "hotel403"
    },
    "body": 200,
    "principal": {
      "subject": "foxtrot",
      "realm": "echo42",
      "roles": [
        "india"
      ],
      "claims": {
        "extra2": "x"
      }
    }
  },
  "stubs": {},
  "expect": {
    "status": "done",
    "output": {
      "allowed": true
    },
    "nodes": {
      "op": {
        "status": "done",
        "handler": "graph:@features/access/domain/require-employee.graph.json",
        "out": {
          "allowed": true
        }
      },
      "op.isEmployee": {
        "status": "done",
        "selected": "granted",
        "out": "granted"
      },
      "op.granted": {
        "status": "done",
        "handler": "@std/object.port.json#make",
        "out": {
          "allowed": true
        }
      },
      "op.forbidden": {
        "status": "cancelled"
      },
      "op.anonymous": {
        "status": "cancelled"
      }
    }
  }
}
