{
  "$schema": "https://raw.githubusercontent.com/wilanis/wilanis-js/main/packages/core/schemas/scenario.schema.json",
  "description": "refresh under seed 1 with refreshToken empty: failed. Written by wilanis fuzz --edges; regenerate it, do not edit it.",
  "generated": "edges",
  "trigger": "@features/access/edge/refresh.trigger.json",
  "seed": 1,
  "in": {
    "refreshToken": ""
  },
  "context": {
    "method": "juliet527",
    "path": "Zulu-9",
    "headers": {
      "extra6": "kilo"
    },
    "cookies": {},
    "query": {},
    "params": {},
    "body": {
      "refreshToken": "hotel403"
    },
    "principal": {
      "subject": "charlie",
      "realm": "bravo",
      "roles": [
        "echo42",
        "golf",
        "lima205"
      ],
      "claims": {}
    }
  },
  "stubs": {
    "op.traded.op": {
      "refreshed": false
    }
  },
  "expect": {
    "status": "failed",
    "reason": "invalid_refresh",
    "nodes": {
      "op": {
        "status": "failed",
        "reason": "invalid_refresh",
        "handler": "graph:@features/access/domain/refresh.graph.json"
      },
      "op.traded": {
        "status": "done",
        "handler": "@features/directories/data/identity.binding.json#refresh",
        "out": {
          "refreshed": false
        }
      },
      "op.traded.op": {
        "status": "done",
        "handler": "@auth/token.port.json#refresh",
        "out": {
          "refreshed": false
        }
      },
      "op.wasGood": {
        "status": "done",
        "selected": "invalid",
        "out": "invalid"
      },
      "op.renewed": {
        "status": "cancelled"
      },
      "op.invalid": {
        "status": "failed",
        "reason": "invalid_refresh",
        "handler": "@std/outcome.port.json#refuse"
      }
    }
  }
}
