{"$schema":"https://raw.githubusercontent.com/wilanis/wilanis-js/main/packages/core/schemas/scenario.schema.json","description":"get-customer: get-row 'outcome' otherwise routes to upstreamFailed, which refuses as upstream. Written by wilanis rehearse --record; regenerate it, do not edit it.","generated":"rehearse","trigger":"@features/customers/edge/get-customer.trigger.json","branch":{"graph":"@features/customers/data/get-row.graph.json","node":"outcome","when":"else","to":"upstreamFailed"},"seed":1,"in":{"id":"hotel403"},"context":{"method":"juliet527","path":"Zulu-9","headers":{"extra6":"kilo"},"cookies":{},"query":{},"params":{"id":"hotel403"},"body":200,"principal":{"subject":"foxtrot","realm":"echo42","roles":["india"],"claims":{"extra2":"x"}}},"sharedStubs":{"op.customer:made":"2ddc219028a2f081","op.fetched":"fab51527501ad488"},"expect":{"status":"failed","reason":"upstream","nodes":{"op":"9251feeeb253c1ac","op.fetched":"833c1e22475651d3","op.outcome":"f9ae8cf928d7c095","op.noCustomer":"a0af58eabbdc1659","op.upstreamFailed":"0cd61b35d9bf3fe9","op.unreachable":"a0af58eabbdc1659","op.customer:made":"a0af58eabbdc1659","op.customer:check":"a0af58eabbdc1659","op.customer":"a0af58eabbdc1659","op.customer:violated":"a0af58eabbdc1659","op.customer:violated:2":"a0af58eabbdc1659"}}}
