{"$schema":"https://raw.githubusercontent.com/wilanis/wilanis-js/main/packages/core/schemas/scenario.schema.json","description":"enqueue-removal under seed 1 with id one: done. Written by wilanis fuzz --edges; regenerate it, do not edit it.","generated":"edges","trigger":"@features/customers/edge/enqueue-removal.trigger.json","seed":1,"in":{"id":"x"},"context":{"method":"juliet527","path":"Zulu-9","headers":{"extra6":"kilo"},"cookies":{},"query":{},"params":{"id":"hotel403"},"body":200,"principal":{"subject":"foxtrot","realm":"echo42","roles":["india"],"claims":{"extra2":"x"}}},"sharedStubs":{"op.published":"a8367efae5e89278"},"expect":{"status":"done","output":"Zulu-9","nodes":{"op":"9e0577cffbd6ff68","op.published":"95f3171201487f15","op.queued":"cae7ac8c948af9e7"}}}
