{"$schema":"https://raw.githubusercontent.com/wilanis/wilanis-js/main/packages/core/schemas/scenario.schema.json","description":"list-customers: list-rows-by-tier 'outcome' when status == 404 routes to none, which answers. Written by wilanis rehearse --record; regenerate it, do not edit it.","generated":"rehearse","trigger":"@features/customers/edge/list-customers.trigger.json","branch":{"graph":"@features/customers/data/list-rows-by-tier.graph.json","node":"outcome","when":"status == 404","to":"none"},"seed":1,"in":{"tier":"silver"},"context":{"method":"juliet527","path":"Zulu-9","headers":{"extra6":"kilo"},"cookies":{},"query":{},"params":{},"body":true,"principal":{"subject":"delta489","realm":"bravo","roles":["echo42","golf","lima205"],"claims":{}}},"sharedStubs":{"op.all.op.fetched":"c92f3586f5de9164","op.byTier.op.none:made":"cb789ea34b239204","op.byTier.op.requested":"6239101ffc63bf13"},"expect":{"status":"done","output":[{"id":"alpha","name":"Zulu-9","email":"echo @","tier":"kilo","active":true},{"id":"hotel394","name":"lima190","email":"alpha @","tier":"india"}],"nodes":{"op":"0181a7c60fe12570","op.tierGiven":"30d7fa13f77292b3","op.byTier":"aee30e8b104521be","op.byTier.op":"55e2745906a5e06e","op.byTier.op.requested":"bda88ffca29ab6c3","op.byTier.op.outcome":"d9a4a0180f5c56b1","op.byTier.op.upstreamFailed":"a0af58eabbdc1659","op.byTier.op.customers:made":"a0af58eabbdc1659","op.byTier.op.customers":"a0af58eabbdc1659","op.byTier.op.none:made":"a0e77403c1c3cac5","op.byTier.op.none":"7dadad66604bd45b","op.all":"a0af58eabbdc1659"}}}
