{"$schema":"https://raw.githubusercontent.com/wilanis/wilanis-js/main/packages/core/schemas/scenario.schema.json","description":"export-customers: list-rows 'outcome' when status == 200 && has(body) routes to customers, which answers. Written by wilanis rehearse --record; regenerate it, do not edit it.","generated":"rehearse","trigger":"@features/customers/edge/export-customers.trigger.json","branch":{"graph":"@features/customers/data/list-rows.graph.json","node":"outcome","when":"status == 200 && has(body)","to":"customers"},"seed":1,"context":{"method":"juliet527","path":"Zulu-9","headers":{"extra6":"kilo"},"cookies":{},"query":{},"params":{},"body":true,"principal":{"subject":"delta489","realm":"bravo","roles":["echo42","golf","lima205"],"claims":{}}},"sharedStubs":{"op.all.op.customers:made":"cb789ea34b239204","op.all.op.fetched":"605ee3cb9793ba30","op.file.op.file":"4f1973e473eb5297"},"expect":{"status":"done","output":{"id":"blob-4227","contentType":"text/csv","size":34398,"filename":"lima.csv"},"nodes":{"op":"fb4124a7464a8c66","op.all":"e4f500b17c266a29","op.all.op":"b490cb8892815f68","op.all.op.fetched":"d23cc7681d5ed24b","op.all.op.outcome":"a2e7a166314e5583","op.all.op.upstreamFailed":"a0af58eabbdc1659","op.all.op.customers:made":"f0bd9ed7343d5cf9","op.all.op.customers":"1f954aa88dee0068","op.file":"d447016c7e0e3307","op.file.op":"3243be7393f451c8","op.file.op.file":"dc4d849ec13ef281","op.file.op.in:ok":"bcc412a142ac12ee"}}}
